2015-04-23,Video Chat with Amy Rosenthal,"
Have a good logging system with tagging to collect useful feedback from visitors at the tradeshow.Get Sarah's physical portfolio book to be displayed during the tradeshow and see how users interact with it and also to give a context of what we are trying to doMake sure we understand the venue, how the tables are setup, what layout is planned, equipment available etc.Change the Thank You page to give a more compelling visual cue that we have gotten their feedback and we really care about itPut up Sarah's video on the home page, which can be displayed at the tradeshow easilyAbout the home page, give some context about what they are seeing, more cues to draw user in.

Consider icons like stacked docs for pictures to show the pictures have more content and stories once clicked.When hovering over the images, there is no information about the designer. Have some way of showing the designer info at this stage because our platform is centered around itMake sure this website is tablet friendly - not by the tradeshow date, but definitely when showing to real users and trying to convert themRe-organize the story pages - Give more prominence to the image in terms of positioningIs there a way we can share individual images to social media channels from within the stories/chapters? Or should we keep the sharing at a story level . To begin with, Scott thinks we should keep it at the story level and then look at how users are using it and then adapt.Make sure Tumblr is added to the social media integration list, in addition to pinterest, twitter, facebook, instagramHide the top navigation bar when users start scrolling through the storiesCopy Amazon review styling for text where the text fades off after a few lines. Do that after one or two lines in the description sectionAllow users to upload in landscape orientation also. Create an additional template for thatDesigner info should tuck under once users starts scrolling through the chaptersAdd invite feature to the platform so that users can invite othersUse CMS modules to integrate it in to the website - like drupal and wordpressMake sure users can upload multiple images while uploadingLPC feedback - The ideas seem to be disconnected. Put more details in and see if you can track the user stories all the way to hypothesis.","Launch planning, website design feedback",Mentor Engagement,,Software development with heavy focus on the aesthetics and design.
2015-04-21,Thimble Presentation 04/21/2015,,,Team Presentation,,
2015-04-17,"In Person Meeting with Ria Manyari, Designer - Luxury Leather products, Ria Manyari","Ria has been in the business for a few years and comes from a line of fashion designers. She has an MBA and understands the business of fashion very well, and is trying to expand her business. She has 2 stores carrying her designs and she is looking for more stores. She was really interested in Thimble and said it is exactly what she is looking for and will be a supplemental tool to her website and other social media presence.",Most important thing as a new fashion designers with a line is to get discovered by boutiques.,Customer Interview,Customer Segments,Stylists looking for accessible fashion designers with unique, good quality pieces - Personal Shoppers, Bloggers; Boutiques(stores/entities who have two or three fashion specialty stores - www.thegreengoddessboutique.com, www.frankiesonthepark.com)
2015-04-17,"In Person Meeting with Michael Blossom, Owner/Buyer/Stylist, Florodora","Michael Blossom was one of the panelists for a discussion on buyers in fashion industry at Lake FX Chicago summit. He said aspiring fashion designers are very important to his business,&nbsp;as he is always on the look out for new fashion designers with fresh designs, as that the only way they can differentiate&nbsp;themselves&nbsp;from the retail&nbsp;store like Macy's, Target, Nordstrom. He explained his process on how he selected new designers or lines. His store gets a phone call from a designer, and the person who picks the call asks the designer to send an email with some pictures of his/her collection. They can also send snail mail with photos. Michael goes through all the emails and snail mails they receive and makes a decision whether to ask the designer to send in samples. He said snail mail is still relevant and many people, especially in the fashion industry values that. When I asked him about how he finds designers himselves and reach out to him, he said he looks at competitior websites and keep track on designers who are featured in their stores. If he finds someone promising, he search for there name in google and contact them.","Stylists/Buyers look at other successful Stylists/Buyers/Boutiques for input/info on what is selling and who(designer) needs to be contacted to be featured in the store. Boutique owners are always on the look out for new fashion designers with fresh designs, as that the only way they can differentiate themselves from the retail store like Macy's, Target, Nordstrom.",Customer Interview,Customer Segments,Stylists looking for accessible fashion designers with unique, good quality pieces - Personal Shoppers, Bloggers; Boutiques(stores/entities who have two or three fashion specialty stores - www.thegreengoddessboutique.com, www.frankiesonthepark.com)
2015-04-21,Fashion CAD software companies,,,Business Model Hypothesis,Key Partners,
2015-04-21,"City of Chicago - Chicago Fashion Incubator, Mayor's Fashion Council",,,Business Model Hypothesis,Key Partners,
2015-04-21,"Advertisement revenue from Sourcers, Manufacturers, fashion agencies etc",,,Business Model Hypothesis,Revenue Streams,
2015-04-21,"Selling Data analytics for fashion trend forecasters, retail stores, fashion houses etc",,,Business Model Hypothesis,Revenue Streams,
2015-04-21,Charging publishers/editors for premium content access,,,Business Model Hypothesis,Revenue Streams,
2015-04-21,"Enterprise/Buyer fees for workflow automation(like ERP, CRM hooks), reporting, content creation etc",,,Business Model Hypothesis,Revenue Streams,
2015-04-21,Freemium model - Free for all,,,Business Model Hypothesis,Revenue Streams,
2015-04-21,***** Phase III - Expansion,,,Business Model Hypothesis,Revenue Streams,
2015-04-21,***** Phase II - Monetization,,,Business Model Hypothesis,Revenue Streams,
2015-04-21,***** Phase I - User Acquisition,,,Business Model Hypothesis,Revenue Streams,
2015-04-21,"Rent expenses and other related expenses like furniture, internet, power, misc.",,,Business Model Hypothesis,Cost Structure,
2015-04-21,Salaries for fashion design consultant to review designs on the page and rank/curate them,,,Business Model Hypothesis,Cost Structure,
2015-04-21,"Google Ads, Facebook Ads , Other paid advertisements",,,Business Model Hypothesis,Cost Structure,
2015-04-20,Video Chat with Jon Friedman,"Jon said our business should really be to help designers with the business side of their craft – that it's right in front of our faces, but we are falling into the trap of many first-time startups in that we'd rather build something pretty than something functional. There's some validity in his channel point – that designers already have a lot of channels and we'd just be adding one more they don't know how to use totally effectively. At this point, we agreed it's too late to pivot before next week, so we're pressing on with our idea for the sake of the class, but we may pivot in future weeks.","In short, Jon said our idea is not viable because he doesn't think creating another channel is really solving a problem. He thinks helping designers better use existing channels would be more productive.",Mentor Engagement,Customer Relationships,Discerning fashion consumers looking for independent fashion; Independent fashion designers can tell stories about their creation to create a context and connect to a community; Discerning Fashion consumers want to understand the story behind a fashion item to feel connected to a designer; Stylists looking for accessible fashion designers with unique, good quality pieces - Personal Shoppers, Bloggers
2015-04-21,"In Person Meeting with Jakina Ado, Independent Photographer, Independent (Jakina Ado)","After I gave Jakina the Thimble elevator pitch, she gave me her card and said the idea sounded really interesting, and that we should be in contact going forward once we establish ourselves a bit better in the market.","Jakina said she loves the idea of fashion storytelling, but her real value to us is that she's looking into founding a magazine (she didn't offer many more details than that), but she gave the impression that she'd love to speak to us in the future if we really establish ourselves as a viable product.",Customer Interview,,Fashion Magazines like Vogue, Elle etc
2015-04-17,"In Person Meeting with Masha Titievsky, Fashion Designer, Varyform",We secured Masha as a prospective user for our platform.,"Storytelling matters to Masha, who founded Varyform Design and is vying to join Chicago's Fashion Incubator.",Customer Interview,Value Propositions,Independent fashion designers can tell stories about their creation to create a context and connect to a community
2015-04-15,"Participating in Tradeshows, Industry Events",,,Business Model Hypothesis,Cost Structure,
2015-04-13,"In Person Meeting with Arnab Majumdar, Assistant Professor - Fashion Business, Columbia College Chicago","Arnab asked us to talk to Chicago Fashion Incubator after hearing our initial pitch. It is a fashion incubator by SAIC, City of Chicago and other entities interested in keeping fashion talent in the city. He gave us a contact who is currently in the incubator to schedule a meeting with. He said that stylists are usually working with agencies like v.mora, celestine etc and we should look into these agencies to understand the dynamics. He thinks that sounds more like a fashion ecosystem and he pushed us to think about solving the sourcing and marketing challenges faced by fashion designers. He said Makers Row is a dead website and he rarely get responses from them. He even mentioned that international sourcers should also be featured. He also said it might be a good idea to consider this platform as a virtual tradeshow platform. He talked about MAGIC, which is an annual fashion tradeshow in Vegas, which is usually not very affordable to independent fashion designers and simulating the exposure and accesses in tradeshows might be very useful for these people who usually cant afford to make it. He also touched upon fashion forecasters like WGSN, whom stylists in big companies dependent on for predicting next season's fashion. This is a very expensive service and he said if we can make it affordable it might be an attractive aspect. About disrupting workflows in fashion and using digital media and devices, he said that currently students in Columbia college is not using tablets or any other digital medium to sketch, but he thinks this is a weakness and should be integrated into the program. But he did say that none of the software available is still not of quality to be used. He talked about Optitex, which is a fashion PLM software and he has been working on integrating it to the curricula. About the secrecy question, he said there are a few people who might be sensitive to that, but he he is seeing a trend where people are not too concerned about it, especially with the ubiquitous of mobile phones, tablets and internet access.",Think of this platform as something that replaces tradeshows and builds a fashion ecosystem. Marketing and Sourcing is a big challenge for all in the fashion industry and try to focus on that.,Customer Interview,,Columbia College Chicago; Access to Fashion Designers
2015-04-08,"Phone Call with Sheeba Iype, Owner, Grace Technology Partners, Recruitment Consultancy","
Mostly handles tech recruiting and has never handle any fashion recruiting.Talk to Kathy Thomas, GM Merchandising(contact info given) at Anthropologie for more info on recruiting.Shops highend, in fashion items - Gucci, Chanel etc.Shop at Niemann Marcus and has a personal shopper/stylistRarely shops online as she has a stylist who knows her well and calls her if something goods come in.Totally loves the&nbsp;experience&nbsp;and trusts the stylist,&nbsp;even though&nbsp;she knows they works for commissionShe says that Niemann Marcus stylists are never pushy and they really understands you once they know that you will purchase from themShe also said that if you are a new customer, they will profile you and will show interest only if they think you will buy something. So how you dress and accessorize when you go into the store is very important.Typical customer base of NM is affluent females who are very fashion&nbsp;conscious&nbsp;and like to fly in the social circles. She said she rarely sees people who are younger than 40 in the stores.About the changing shopping habits of the Millenials and the younger generations, she feels that its all steming from a kind of entitlement because of the more well supported childhood and adolescence these generations have. Most dont have to work for college and rarely goes through the financial crunch their older generations had to go through which makes them less worried about money and more focused on quality of life.",Personal Stylists are more of a convenience for those who dont care how much they pay for what they wear.,Customer Interview,Customer Segments,
2015-04-13,"Phone Call with Jon Friedman, Advisor, Apollo Education Group","We talked about the branding and trademark issues we've run into on the business side over the past week, but Jon said not to worry about since we're not a threat to anybody and won't get sued. He said we need to focus on acquiring a customer base, and not be afraid about showing them a not-ideal product on the front end. He said we should make people understand it's an early-stage product, and that because it's so early, their opinions are formative. He also recommended filepicker.io for the devs, who've had issues with image uploading.","John said don't worry about ""champagne problems"" until we've launched a product and have a customer base. Until we've launched, just focus on acquiring customers.",Customer Interview,Key Resources,Social media; Advisory Board members; Access to Fashion Designers
2015-04-07,"Phone Call with Ginger Hartwell, Global Marketing Manager, Proctor and Gamble, Abbott","Ginger worked as the Social Media SME for global beauty and grooming products for P&G. She agreed that beauty/grooming industry is codependent with fashion &nbsp;and there is an interesting opportunity at the intersection of these industries. Bloggers are critical to create virality for products and corporates are always on the lookout for such bloggers and content creators. There are agencies in each of these spaces who knows all the influential bloggers and consult with corporates on using them to advertise their products on a shoestring budget. In the beauty industry, the strategy is to understand the target market, find bloggers who caters to that market and give free samples to these bloggers to review. Checkout tongal.com. Lot of corporates use this website to get marketing ideas by tapping into the &nbsp;authenticity of user generated content which results in virality.&nbsp;",Key factor corporates look from independent bloggers is the target market they are focusing and their following in that market.,Customer Interview,Value Propositions,Discerning Fashion consumers want to understand the story behind a fashion item to feel connected to a designer
2015-04-07,"Fashion Magazines like Vogue, Elle etc",,,Business Model Hypothesis,Key Partners,
2015-04-07,"Fashion Blogs like chicityfashion.com, refinary29 etc",,,Business Model Hypothesis,Key Partners,
2015-04-07,"Attending fashion events(Fashion Shows, Collection Launches, Fashion Networking parties)",,,Business Model Hypothesis,Customer Relationships,
2015-04-07,"Boutiques(stores/entities who have two or three fashion specialty stores - www.thegreengoddessboutique.com, www.frankiesonthepark.com)",,,Business Model Hypothesis,Customer Segments,
2015-04-07,"Stylists looking for accessible fashion designers with unique, good quality pieces - Personal Shoppers, Bloggers",,,Business Model Hypothesis,Customer Segments,
2015-04-07,Lots of Portfolios,,,Business Model Hypothesis,Key Resources,
2015-04-07,Access to Fashion Designers,,,Business Model Hypothesis,Key Resources,
2015-04-07,Industry contacts,,,Business Model Hypothesis,Key Resources,
2015-04-07,Email marketing,,,Business Model Hypothesis,Customer Relationships,
2015-04-07,Kickass dev team,,,Business Model Hypothesis,Key Resources,
2015-04-07,Advisory Board members,,,Business Model Hypothesis,Key Resources,
2015-04-07,Software development with heavy focus on the aesthetics and design.,,,Business Model Hypothesis,Key Activities,
2015-04-07,Onboarding designers on to the platform and ensuring that there is a value prop for them without the other side of the business(buyers) on the platform,,,Business Model Hypothesis,Key Activities,
2015-04-07,"Customer acquisition fees, marketing costs associated with acquiring customers(eg: Professional photo day, Story/Design Workshops, Sponsership for fashion events etc)",,,Business Model Hypothesis,Cost Structure,
2015-04-07,Raise $100K in the first year and $250K in the second to keep the business running,,,Business Model Hypothesis,Key Activities,
2015-04-07,Connections at fashion schools,,,Business Model Hypothesis,Customer Relationships,
2015-04-07,Social media,,,Business Model Hypothesis,Customer Relationships,
2015-04-07,Salaries for Employees,,,Business Model Hypothesis,Cost Structure,
2015-04-07,"Level based membership fees for stylists & buyers ... i.e charge for certain features line sheet access, manage appointment, basic analytics and trend forecasting",,,Business Model Hypothesis,Revenue Streams,
2015-04-07,"Fashion Buyers - Stores, Boutiques, Other",,,Business Model Hypothesis,Key Partners,
2015-04-07,"Amazon Web Services, Other subscription based IT tools(Heroku addons like Postgresdb, Cloudinary, SSL certs, Domain hosting)",,,Business Model Hypothesis,Cost Structure,
2015-04-07,Kent State University,,,Business Model Hypothesis,Key Partners,
2015-04-07,Social media,,,Business Model Hypothesis,Channels,
2015-04-07,Thimble webapp,,,Business Model Hypothesis,Channels,
2015-04-07,HR Consultants specialized in Fashion Placements,,,Business Model Hypothesis,Key Partners,
2015-04-07,HR Depts. in Fashion Industry,,,Business Model Hypothesis,Key Partners,
2015-04-07,FIT New York,,,Business Model Hypothesis,Key Partners,
2015-04-07,Parsons,,,Business Model Hypothesis,Key Partners,
2015-04-07,Columbia College Chicago,,,Business Model Hypothesis,Key Partners,
2015-04-07,School of Art Institute,,,Business Model Hypothesis,Key Partners,
2015-04-03,Video Chat with Swathy Prithvi,"- Having the ability to sell is the ultimate goal of the website - so make it easy to reach out and buy if people are interested - just exposure does not  have enough meat to attract users back- Council of fashion desingers of America(CFDA) partners with Vogue and runs a competition every year - check them out and see how they do it- Target end consumers(in our case fashion desingers) to build content and then go to Stylists- Position interviews as student project when talking to publications or else they will look at you though the business value lens- We should get more design portfolios to get a foot in the door- Focus on Local designer base and schools as it is more accessible to get more portfolios on your website - 300 to 500 designers is a good target and will get you into boardrooms- Content creation and strategy is very important and Clayton can be the Editor in Chief as he has the most skill on that segment, but everybody on the team should be creating content and constantly looking and thinking of opportunities on how to do it- Remember social media is a distribution channel and amplifier and is never a replacement for content- nastygal.com has a cool feature where people can buy through instagram- Growth hacking idea - photography - hire a photographer and models - portfolio day - take professional shots - might involve some $$ but worth it- Target community colleges and lesser rated fashion schools first so that you can refine the pitch. Get out of the room and try to reach out to them in person.","focus on easily accessible targets(local, novice) to scale up customer acquisition faster",Mentor Engagement,,Independent fashion designers can tell stories about their creation to create a context and connect to a community
2015-04-07,"Email with Josie Hutch, Fashion Merchandising Student, Kent State University","Josie doesn't think designers are worried for their inspiration to be ""ripped off, though there is the possibility that the physical garment might be worth worrying about. From what she knows, designers showcase their inspiration. Then after the garment is developed, the inspiration adds to the story and creates almost a piece of art in itself.","Josie agreed with Sarah that if we showcase the inspiration piece after or alongside the final product, then we can circumvent the secrecy problem.",Customer Interview,Customer Relationships,Independent fashion designers can tell stories about their creation to create a context and connect to a community
2015-04-07,"Email with Luke Zhang, Independent Fashion Shopper, N/A","Luke is not concerned with how a piece of clothing comes to be, only what it is. He doesn't think that I would take the time to read about a specific piece of clothing, unless it was an extenuating circumstance, like if he was attending a trunk show or the designer was present to sell him that piece of clothing. He said he'd love to talk to a designer, the person who made my clothes – there's definitely a class of people with a certain socioeconomic background who can afford the time and money to take the time to understand the piece of clothing and designer, and then purchase the items altogether. We should shoot higher.Buying online comes with problems. Trial and error can only work for so long, but if you can limit the statistical error between buying an item of clothing and finding out that it doesn't fit, that's attractive to consumers. If we could store consumer measurements, that'd be helpful as well.","Luke said a design story is impersonal, but that he would enjoy the opportunity to actually communicate with a designer to learn about a piece's background.",Customer Interview,Value Propositions,Independent fashion designers can tell stories about their creation to create a context and connect to a community
2015-04-06,"In Person Meeting with Dhruv Parikh, Customer Interview, Northwestern Student","Will never shop online because it is too risky for him in terms of fit and body structure. That being said, if opening a way of communication with a designer can facilitate a process that can address the issue of fit he would be interested. Price is major component to his decision though.",,Customer Interview,,Discerning fashion consumers looking for independent fashion
2015-02-27,"In Person Meeting with Abigail Lippi, Stylist, Independent","What does context mean? Need cues...  / Add entry, not intuitive.  Can other people see what was bought and show how they use it and make a social network/ picture compression is bothering / any other inputs or information on the page/ if you really believe in your design no issues with sharing/ a platform to challenge designs/ talentell website/ Found all designers by word of mouth. Have an identifier so people know its thimble later. Focus a lot more on aesthetics. Consider featuring designers who are doing good using the platform./ files archive of fashion images. Fashion shows/  inventory of designers categorizing by location, aesthetics, type/ Retrospective by designers Antwerp museum. / One of a kind pieces should be considered for tracking evolution/ Likes that it specialized for fashion designer/ Kick starter section within thimble/ upload sketches to thimble and raise money for production/ Instagram requires you to just visit the page and they see you.",Stylists are looking out for promising fashion designers. No problem with sharing story. Aesthetics of the platform is key.,Customer Interview,,Discerning fashion consumers looking for independent fashion; Discerning Fashion consumers want to understand the story behind a fashion item to feel connected to a designer
2015-04-07,"In Person Meeting with Rohan Agarwal, Customer Interview, Northwestern Student",He is a novice fashion enthusiast and is slowly trying to move his way into boutique fashion from big fashion brands. Although having a more tangible relationshiop or understanding of the designer's work would be interesting he doesnt see that justifying really high prices for him personally. ,,Customer Interview,,Independent fashion designers can tell stories about their creation to create a context and connect to a community
